{
  "v": 1,
  "schema": "e2e-snapshot-diff-v1",
  "run_id": "01HQXG5M7P3KZFV9N2RSTW6YAB",
  "ts": "2026-02-14T12:00:03Z",
  "body": {
    "comparison_mode": "statistical",
    "baseline_run_id": "01HQXG4K6N2JYFV8M1QRSV5XZA",
    "diffs": [
      {
        "field_path": "results[0].score",
        "baseline": "0.8765",
        "current": "0.8764",
        "delta": "0.0001",
        "within_tolerance": true,
        "tolerance": "0.001"
      }
    ],
    "pass": true,
    "mismatch_count": 0
  }
}
